<?xml version="1.0" encoding="UTF-8"?>
<sales xmlns:xsi="http://www.w3.org/2001/XMLSchema-instance" xsi:noNamespaceSchemaLocation="Q.no.17.xsd">

    <salesman>
        <name title="Mr.">
            <first>John</first>
            <middle>W</middle>
            <last>Doe</last>
        </name>
        <phone type="work">9876543210</phone>
        <area>Pokhara</area>
        <records>
            <record>
                <product productid="P101">
                    <sku>SKU001</sku>
                    <product_name>Laptop</product_name>
                </product>
                <quantity>2</quantity>
                <price currency="usd">1200</price>
                <date type="ad">2025-06-20</date>
            </record>
            <record>
                <product productid="P102">
                    <sku>SKU002</sku>
                    <product_name>Printer</product_name>
                </product>
                <quantity>1</quantity>
                <price>800</price>
                <date type="bs">2082-03-06</date>
            </record>
        </records>
    </salesman>

</sales>